{
  "v": 1,
  "listHash": "43b32a22bf784accc75a5bdcd258e737be48c207b8785269b041eb42b02457e2",
  "index": 0,
  "sha256": "d6edfdc3fbd337ae29197aa9dccba4af4c7a1ec9f193597b5026170f96a6be60",
  "entryCount": 2,
  "encoding": "gzip+base64",
  "data": "H4sIAAAAAAAC/2WNQQuCQBCF7/6KZc4uaHjae4VUZnmMDoM70YLtimsrKf731oQkus289/i+AZQEAU/LzQ1LbqUW2Y4rhzqOohhC0PggP0h9wnJqG+NUeWeFksafvsdKoSUL4jJvlibtvm8H1xDaVz2R8vW5OGYwBsOsrqm24pSskmSxHbBRyDbUaNQS2dboHivqf3R/xHBC7clR9clyGIM3/svw5N4AAAA="
}
